nr,zh,auth,span今天儿子回家说学了一首诗:鹅鹅鹅，曲项向天歌！我问道:这首歌表达了作者的什么意思？儿子想了想道:重要的事情说三遍！,lizong8280,,
"最近生活有点紧张，戴着个口罩拿把水果刀打算抢钱。,在一胡同来一个弱女子，我大喝上前:忒，把钱拿出来，你要钱还是要命？,只见那女子哆哆嗦嗦说:大 大 大哥，我 我 我要钱……！",依然范特西:,,
我是一个铁路客运员，男的。刚刚有个旅客喝醉了，人高马大男的，一直说他有票要拿身份证给我，我说我相信你，不用给身份证。结果在上车前抱着我亲了一个。这么大的人了，第一次被个男的亲了。,,,
好糗啊，去泰国在携程上酒店定错日子了。携程要我自己联系酒店，电话永远打不通。。有没又在泰国皮皮岛旅游的糗友啊，能不能帮我联系下酒店咯，酬谢。,生活如此多脚,,
年离我们越来越近了,千年轮回欧耶,,
老公总说要我没用，我说你想怎么有用？老公说要我就为了干我的，我瞬间飙起来了，捏着老公的脸，恶狠狠的对他说：你丫的，能好好干好么？昨天没干，前天没干，今天还不想干，咱们能不能敬点业？不要三天晒网两天打鱼！！结果老公直接钻被窝不说话了…怎么破？,,,
"大宝问：妈妈，为什么你长大了要离开你的爸爸妈妈？,我说，因为我长大了要跟你爸爸结婚，爸爸去哪，我就要去哪里。,大宝高兴的说：妈妈那我长大了要跟你结婚…",abc霓裳,,
今天跟老公去朋友家，好多朋友都在，老公的哥们在一边拿手机打开京东网跟我说:在这上面给我老婆买了点东西，我刚想跟老公说看看人家对媳妇多好，这话还没说出口呢，那哥们又来了一句:花了一块五还包邮。哎吆歪我这坐着笑了半天。一块五  一块五还包邮 包邮……邮……邮，真服了这群铁公鸡们。,情缘奇份,,
这广告也是real尴尬,摸摸二哈的毛尾巴,,
因为一个人，爱上一座城……,tjmjgtm,,
今天去超市买猪肉，称好以后放到了一边，然后就有人问：“谁的肉，谁的肉”，我赶紧说：“我的肉，我的肉”。谁知那人嘴欠的来了一句：“是你的肉吗？”引来周围的人哈哈大笑，我当时一愣，反应过来也跟着大笑了,打不倒的光头强,,
点了个外卖，半小时就到了，外卖小哥敲了2分钟门，女孩纸嘛，穿衣服肯定慢啦，等我穿好衣服开门，外卖小哥看我的眼神都不对了。似乎还想把头伸进来瞅瞅。没毛病,红妆是为谁,,
昨天兄弟交了个女朋友，喊哥几个吃火锅，就当我们在里面夹菜的时候，她说了一句：你们能不能不在里面洗筷子，我都不想吃了。我瞬间好尴尬，但是没说话。今天他们分手了，我们又去那里吃火锅,饮最烈的酒、艹最爱的人,,
我是老大，,123宝贝123,,
刚骑自行车回家，发现阴暗处有对男女搂搂抱抱，便侧目多看了几眼，不料前面有个小坑，自行车不受控制冲进了旁边的水沟里！哎，夜路走多了，总是会碰到虐狗的……,你亖不亖傻！,,
"有一个问题:相恋六年分手 是一种怎样的体验？,有人说:总是要一遍一遍提醒自己现任的昵称，怕一顺嘴喊出前任的名字！,有人说:像死了一个至亲！",林、妹、妹,,
"想着过几天出省回娘家了，省内免费流量用不了，那也不能浪费了，晚上关了家里的WiFi，用流量下几首歌，下了几个影片……早晨提示手机欠费了……呃……离出省的日子还有一周呢……,胖香",莫纳~纳花依然,,
本人小小库管一名，虽然每天工作量不大，但是有的时候也挺费力气的，今天老板说明年给我找个伴，找个力气大的男的！老板说的挺认真，我却在心里猥琐的笑了！！,郎海曼,,
那天站岗，我们部队养了一只小白狗，是土母狗，勾引了好几个外面的野狗。在我站岗期间，他俩Xxoo，我看不下去了，拿着应急棍把她俩打开，敢在我单身面前搞这种见不得人的事，坚决反对。,南漂者渴望幸福,,
"表姐二婚，男方带个小女孩，表姐告诉小外甥“以后要好好照顾妹妹，疼妹妹，不许欺负妹妹”小外甥“麻麻，蜀黍，你们放心吧，我会像疼自己老婆一样疼她的！”,醉酒舞剑砍疯子※",睡觉撞墙卡跟头,,
"李媒婆来我家说给我介绍一个对象，问我想要什么样的，我说:现在也没啥要求，一是女的，二是活的。,李媒婆双眼放光问我:你看我行不行？",依然范特西:,,
一铁哥们，最大爱好就是买打 折 狂 甩的东西，一看见这类的，保 证 立 刻 杀 进 去 血 拼，周末哥几个单身汉 聚 餐，看到一家店 狂 甩，这货“嗖”就进去了，拉都拉不住，结果进去才知道，是女 士 内 衣 店 狂 甩！！,睡觉撞墙卡跟头,,
今天监考，发现有个同学的草稿纸……,Nick_uestc,,
当年在韩国打工，有两个东北人甲和乙是老乡。甲在家学习就很好，来韩国之前还上了半年韩语学习班，认识很多韩国字，不过不爱说话。乙在家就是个学渣，韩国话一句也不会，不过特别喜欢跟韩国人交流。每次一说他那阴腔怪调的韩国话时，就惹得周围人哄堂大笑。乙也不气馁，也跟着笑，然后继续说。这样一年过去了，甲的韩语水平，基本还是原地踏步。而乙和韩国人已经能够非常流利的对话了。,一夜秋雨满城凉,,
目前欧洲很多地方积雪1.5米，，，，把1米55的郭敬明放那里，就只剩一坨华丽的黄毛，在发胶的亲昵下骄傲的45度角，指向天空的阴霾，，，，他那滴了闪亮滴眼露的明眸或许正在雪下悲伤逆流成河。。,追妞来嫁我,,
我姥姥老年痴呆，前几天我去看她，她告诉我说我姨姥姥来了（姥姥的双胞胎姐姐）！我问她姨姥姥在哪呢？她指着镜子告诉我说:“在这里好几天了，我指指她她就指指我，我摆摆手她就摆摆手，我皱眉她就皱眉就是不说话，气死我了！”,……从此萧郎是路人,,
超级讨厌那种拿起酒杯就要喝醉，喝醉还胡言乱语，大吵大闹的人，一脸天下唯我独尊的鸟样，哪怕你是我老子我都想上去给你几巴掌！,丫的蛋蛋,,
学电脑那年，正赶上非 典，学校里不让回家，眼看就快没钱吃饭了。一个同学提议:要不咱们去捡废品吧，旁边就是收废品的，兴许能卖点钱。得到了我们所有男生的同意。于是，在一个炎热的中午，我们几个人拿着从收废品的那里捡来的小钢锯条，跑到了河边，照着摆渡的钢缆就下手了。怎奈折了了两根锯条都没把钢缆锯断，手上还被磨起了老大一个水泡，只好灰溜溜的回去了。幸好后来校长给了我们每人50块钱，要不然就得吃土了。,cz小李哥,,
2009年下半年那会第一次去广州，买的站票，在火车上遇到了两位大哥哥，见我一个小女孩一个人还是站票，把座位让给了我，他们两个就轮流坐，那时候的我青涩，害羞，内心充满着感恩之情，却不知如何表达，我永远可能见不到他们了，只怪话少的我没有留下联系方式…我还能找到你们吗？,佳呢,,
本人在深圳，开车1月16号回湖南衡阳，祁东，组织有人看到，顺路可联系。可以搭载2人，不用担心费用问题，无所谓。聊天吹牛是王道，福克斯车型。,╰ゝ抽抽疯╮,,
前不久在网上看到一个吸薄荷糖糖的测试，今天终于在好奇心的诱惑下买了一盒来试了试，就那种常见的薄荷糖，一颗把它碾成粉，之后就像电视上吸那粉那样，卷个卷用鼻子一吸，哇(⊙o⊙)！那感觉，有兴趣的朋友可以试试,撸管大IP,,
说个小表弟的，小学六一儿童节，每个班都有文娱表演，他们班大合唱，老师说让妈妈帮他们抹了口红再来学校，然而第二天活动取消了，，全班都知道就他不知道，，，，然后老师就看着全班就他一个男生抹着烈焰红唇坐在教室最显眼的位置笑了一上午。,念Winter,,
"上个月中旬到乡镇出差，早上八点多就出门了，一直忙到下午五点多才坐车回来！由于坐车要两个多小时才能回到家，忙了一整天整个人都累垮了，就在车上睡着了！！经典的是，到站了，楼主还在睡觉，司机都去吃完饭了，回来车上拿东西发现有个人在车里，这司机大哥推醒我“兄弟，你打算在我车上过夜麽？没钱住旅馆？”,尼玛-_-#，司机大哥你真逗→_→。",Jazz桂杰,,
我特么都不知道该怎么说了！ 现在借钱的 你们都是大爷！我经济不给力了，给你们要账，回话是什么？ 我这几天手头也紧啊！缓缓吧！操你妹的，，你们天天给朋友圈今天去这玩了 明天去那吃饭了 小日子过得好不潇洒   有想过劳资是怎么过来的嘛！,名字越长吊也长,,
今天和我一起住宿的女孩回家了！晚上我去看了一个足疗兼职！感觉有点不正规就回来了     割了我得心       觉得好压抑觉得没人就想大哭一场！我还没哭几声呢！我同事出来了！以后怎么见人！告诉我该怎么办怎么办,专治鼻炎咽炎,,
友情提示！冬天穿长衣服蹲坑的时候一定要记得把衣服撩上去！不要问我为什么！一上午被屎味围绕着却不知道原因，直到被女同事发现后……PS:（目前已请假一星期）,舌尖上的蛤蜊,,
小张给公司领导发短信：“王经理，我明天请一天假，现在在医院。”“你怎么了？”“骨折了。”“怎么弄的？”“喝了杯酸奶。”“别他妈骗人！你当老子傻吗！”“我没经过我老婆的同意喝了她的酸奶，她把我打骨折了！”,壹抹蓝天,,
最少5个字,abc霓裳,,
和朋友一起喝夜啤酒，碰见朋友表哥路过，于是叫住表哥一起喝，表哥刚坐下倒了一杯酒还没喝就起身离开了，隔了一会我问朋友表哥怎么回事，朋友顺口开玩笑回答说，    他表哥不回来这杯酒就留到给他表哥撒到坟上去，这时他表哥刚好隔壁买烟回来听见了。结果那晚上我朋友被罐醉吐了三次。,军军18,,
初中，知道别墅这一词，只是形容好的住所或者房子，位置和城里距离远一些，我考虑的第一个问题就是买菜不方便！不方便！不方便！他妈买别墅旁边开个超市估计球了！,刘艳东111,,
"你们听过最委婉骂人的话是什么！,流水线工作，有规定的工作产量。同事是最后一道，需要记数量。另一同事一天要问她八百遍数量，某次把同事逼急了，回了他句“还差一个你”。我们面面相觑，同事解释说“还差250”！好吧，咱们不是一个界面！！！！！",哀家要男宠三干,,
“媳妇儿你的舌头咋总舔嘴唇儿呢？”我嘴唇儿被风吹裂了。“啥时候吹裂的？”“刚裂。”“嘻嘻……肛裂（刚裂），肛裂（刚裂）……嘻嘻……”,京华再现稻谷香,,
记得小时候骑马《当时看楚留香传奇》里面的香帅骑的很快，我也模仿。结果掉了下来而且手死死的拽着栓马绳被马拖了好远。这算不算糗事啊？求过！！！,我本南山放牛娃,,
"我有个朋友 脸上长了痘痘。我就说他 一脸的坑坑洼洼。他说我一点文化都没有 它那叫爱情疙瘩。爱！情！疙！瘩！,疙。。。瘩。。。",深海女神掉,,
食堂阿姨神助攻,真情(艾特)小处男,,
"闺蜜是个砍 价 高 手，高到什么程度呢？闺蜜开车带我去参加聚会，半路遇到个碰瓷的，非要两千块，结果闺蜜晓之以理，动之以情，一路 杀 价，最后给了十块钱！,醉酒舞剑砍疯子※",醉酒舞剑砍疯子※,,
小刁和岳父母在一块生活，老两口经常吵架，让小夫妻很伤脑筋。近几天不但不吵了，而且特别和谐，闺女非常纳闷，知道有一天她发现丈夫给爹泡的茶掺上的补品时，才知道这个种有多坏！你真坏！,枯树老藤,,
逛超市的时候碰到了女同事——买的东西很有用，可以割了——我问她买的什么啊，她一边说一边拿给我看：一根火腿、一根黄瓜、一根胡萝卜。我看完之后惊奇的问她，你这是要干啥啊？她看我很惊奇，愣了3秒，脸一红：尼玛啊，姐做扬州炒饭啊！,ly.。,,
姐姐做完刨 腹 产后，麻 药 过劲了就嗷嗷喊疼，护士去给她揉肚子，她也不让，气的护士脸铁青。过会她就让我找护士给她打止 疼 针，去找了护士好几次，都说时间没到，一会打，当我第N次走到护士站，就听见两护士在聊天说：这也太娇气了，这止疼的晚一会给打，让她知道当妈不容易，另一个说，对呀，不养儿不知父母恩，让她疼会吧！抬头看见我了， 这回一点也没费口舌，俩人立刻拿起针去给打了。,烟花半夏*,,
爸，我到底是哪里捡的？我要找回去。。。,张鸿明,,
"今天和五岁的儿子上街，碰到个穿着和服的日本女人！儿子盯着她看了好久，然后好奇的问道：,“爸爸！爸爸！你看那个阿姨，她穿着床单，还背着枕头！她这是不是准备在街上睡觉啊！？”,我望了望那个日本女人，看着儿子竟然无言以对。。。。",,,
5年前初恋，很穷，但那是我一辈子最开心，最快乐的时光！我们仅仅是坐在一起，我都会感到很幸福感，是你点亮了我的世界，在我觉得与社会格格不入的时候给了我前进的动力。让我融入社会，让我努力加油，你父母对我说什么时候达到要求才让我们在一起，等我回来时你却嫁人了，嫁给了你以前说你看不起的男人，我开始沉迷游戏，现在对你说这么多就是想告诉你，有人一起开黑么？,他是鬼,,
lz是城里人，老公是农村的。记得刚结婚那年夏天去婆婆家，晚饭准备吃火锅。白天他们都下地去干活留我一人看家，临走婆婆说园子里种的菜好了让我去摘些晚上吃，我一听这是我表现的机会来了，于是拎着小土篮就进园子里了，别说园子里什么都有，有小白菜，茼蒿，香菜，大葱……不一会篮子堆得像小山。晚饭大家吃的有说有笑都挺开心的，忽然不知是谁说的：这小萝卜叶挺好吃的。那尼！姐我什么时候还摘萝卜叶了，那不都小白菜吗？我说怎么小白菜不太一样的，从那以后我轻易我太愿意再摘菜了，因为有的时候会有意外……,姐现在是女神_经,,
刚刚去朋友家吃饭。朋友送我回家。上车坐副驾驶，难得坐副驾驶，一激动，问了句，安全套套哪里？,我不是那个二姐,,
“老板，你这汤里的丸子什么肉啊，看起来有点生?”“那我给你介绍一下吧，朋友，这是猪肉丸子，猪肉丸子，这是顾客。”,失足大爷翠花,,
老婆：老公，你身上有零钱吗？老公看了一眼老婆：我身上怎么会有零钱？老婆啪的一下，然后问道：尼玛，不老实，你身上没有零钱？我早上给你的五块钱呢？老公：老婆，对于我来说，五块钱可是一星期的生活费，这么大数目，怎么会是零钱？,好看的大片子,,
老板出差，老板娘打电话让我下班把电脑给她送回家。老板娘热情的留我吃饭，还炒了一桌子的菜，有清蒸鲈鱼，爆炒腰花，山药炖鸡，韭菜炒蛋……我怎么感觉好像有一场硬仗要打？,時光十年,,
玩腻了想换人了是吧！把Lz惹火了咬掉你的小家伙……,,,
什么叫一见钟情，所谓的一见钟情就是你看见一个女孩，第一想法是很漂亮，第二个想法就是想睡她。,李拜天少爷,,
"上个月上班工时360小时，糗不糗？,糗百大神们，怎么弄死他！",神秘贵贵,,
本人闺女一岁，现正练习说话。各种称呼都已学会，就是唯独一词怎么也不会~婆婆待她特别好，每次让她叫奶奶，她总会说‘蛋蛋，蛋蛋’刚才我正吃方便面，让她练习说面面就给她吃，她反而说了句‘奶奶’，婆婆都惊呆了！又让她说叫奶奶，她还是叫了蛋蛋！！唉！求婆婆阴影面积,,,
"相亲的出来帮个忙,好不容易追了个女朋友昨天才好上，还没来得及跟家里人说。今晚我妈打电话叫明天回去相亲，对方是老妈小时侯老姐妹的女儿，叫我一定回去……,可我昨天好不容易才跟我女朋友说定了她后天要来我家……,我明天怎么应对相亲这事，不能冷脸老妈的老姐妹，更不能让女朋友知道，不然准分手……,突然感觉大风好狠……,倩倩1992",温水红糖哥,,
想我大成都雾霾全球第三，谁能配敌？,所划之地为疆土,,
说一事，肯定被喷，那时候女友上厕所，老是让我陪她去，我说太臭，她说：你不爱我！我说：我爱你，爱的特厉害是不是要吃你拉的屎？……真他么无语……,当！往事随风,,
亲戚坑亲戚从来不手软，妈的，以后爱谁谁。,,,
"同事长的不咋地，但能说会道。每天都把几个人妻女同事逗的开怀大笑。问他都是已婚妇女了，在怎麽逗，都没有结果。他用师傅交徒弟的口气说，眼光要放长远，这叫放长线钓大鱼，看中的是她们背后的资源，比如说，她们的同学，朋友，闺蜜。你还嫩着点，慢慢学吧。,我去，这也可以？",向南就看北,,
"一尾鲤鱼从大盆里蹦出来，摊主捡回，又蹦出来。。。,这么几次后，摊主直接把鱼拿到了案板上:“真那么想跃龙门吗？我帮你！”,然后往鱼头一刀狠狠的拍了下去。。。",奶爸2014,,
今天看见久违的亲人，差点就没忍住眼眶的泪水。有些时候，真的要停下脚步，看看过往，看看那些一直爱着你的人。树欲静而风不止，子欲养而亲不待！所以，善待亲人吧，善待亲人就是善待自己。,温柔的陷阱露露,,
班里有个人考的很好，连着好多次都是第一。老师上课提到她，说“xxx啊，很不错，连续四次……”坐我后面的人接话“全国销量领先”瞬间笑开了-_-!,两只一只猫,,
老爹高血压住院了，今天特地跟护士请假回家，可是爹啊，医院附近虽然伙食不好，可你回家也不能这样吧，要不少吃点也行啊，爹啊，你可别用盆儿吃啊。,改个名好麻烦T^T,,
小时候觉的方便面特好吃，发誓长大了要天天吃方便面，现在他妈的吃的都吐了,青水绿苗,,
这招如何？,小秀才。,,
"今儿午睡，迷糊中接一电话，开着免提接听，一男低音带着无限的幽怨说到 ：一个月内接不到的你的电话，冰天雪地好心寒，估计你是把我已忘记。现在我走了，或许春暖花开我会回来，或许再也不见……,我立马睡意全无，瞅瞅来电号码。我去，送外卖的小哥你不要这样好不好，感觉我欠了你的情债一样……,还有老娘您老人家眼神不要这么奇怪，我的取向一向很正常……",炖在锅里的梦想,,
"他，纵有百子千孙却不能相认，儿孙尽在咫尺，却远在天涯；,他，看着自己的爱人跟别人出双入对，只能默默的离开；,他，是辛勤的园丁，不辞辛劳，不分昼夜给广大妇女送去欢乐；,他就是隔壁老王！",青冥℡,,
"“今天买了件体恤很合身，但是心里有点难过！”,“美妞，你介胖身材买一件合身的就很难得了！难过毛线啊？”,“营业员从男士区给我选的！”,“呃……我该怎么安慰你？”,胖香",莫纳~纳花依然,,
今天第一次去坐高铁，检票进站的时候，那个机子硬是不收我的票，后面的人都催我，然后有个妹子告诉我，机子不收红票，红票。。。仿佛所有的人都知道我第一次坐高铁，真想找个缝钻进去。,秋叶随风ZY,,
"我和嫂子逛街回来，在小区遇见赵姐抱着2岁宝宝，我逗小孩，喊姨！,小宝宝看着嫂子甜甜的喊了一声姨！又看看我，奶奶！,我立马不高兴了，在包里掏出一块糖：喊姨就给糖吃！,小家伙馋的留口水赶紧喊了声，姨！,我美美的和嫂子往家走，听见背后传来小家伙声音：谢谢奶奶。。。,红尘一笑醉红颜～",醉酒舞剑砍疯子※,,
今天跟老公在看丧尸的电影…老公问我要是他变成丧尸了我怎么办…我说…丧尸要喝血的…没事儿…我养着你…我每个月的都存着够养你的了…,沉冰℡,,
这是一家人吗,超猛男,,
小时候在农村里自己盖的小学上学，地上会长很多的草，有天老师说明天带着大家去除草，第二天有的同学带着锄头，有的带镰刀，我牵了头牛。,有魔力的大咖,,
找女朋友千万别找比你大的，不然有一天分手了，别人问你为什么?_?你说是因为她嫌我小，我呢主要是当初她妈嫌我小。,雨恋淋霖,,
和妈妈说起一朋友办婚宴前夕，因为老公打她，然后离婚了，然后妈妈讲起了往事:说我爹从来没打过她，很多重活累活都不让干，就是要她带好我们兄妹三，如果没带好我们，让我们饿着或者哭了，他不会打她也不会骂她，就是什么也不做、也不说话，只抱着最小的我在手上，脸上冷冰冰的，连来家买酒的客人也不理，好像人家欠他什么似的。然后又说起她以前还小的时候喜欢我爹，家里人不同意，外公外婆反而把爹抓到大队里，绑在棍子上，说我爹偷了他们家的东西，大队的问，偷了什么，我外公外婆说:偷了我的女儿。,牵起小毛驴,,
世界上最远的距离不是生与死的离别，也不是我站在你面前你不知道我爱你，而是大冷天的好不容易把被窝暖热乎了却忘记关灯了,圣诞老王,,
终于等到公司发年终奖了，明天我要奢侈一把，去商场买两条内裤,,,
我们公司领导，很会安慰人呀！平时报销费用得一个星期，才下来，这次三天就下来了，因为十号该发工资，公司不发，就先发个安慰奖.....,在那遥远的地方…,,
前几天去美容院点了几个雀斑，脸上留下来一点一点的黑疤，不太明显。今天儿子回来看到了惊诧的问：妈你脸咋了？我逗他说你爸打的。儿子嗤之以鼻，你以为我爸的手是仙人掌呢，拍你这一脸点点......仙人掌....,,,
本人24号左右开车从嘉兴海宁到哈尔滨，有过年回家没买到车票的朋友可以联系我，可乘坐2人！免费！陪说说话就可以！希望可以帮助到买不到车票的朋友！,土---豆,,
"超市工作，食堂吃饭 想喝水，刚好看见同事小芳就说：你帮我带个杯子过来，我一会再给钱你。。。,约莫十五分钟后，这个集智慧才华美貌于一身的女子给我拎来了澳洲的羊毛被子！,我觉得她活在梦里。",小小麦秸杆,,
- 每天用着6位数的密码 保护着我这3位数的余额 心好累,林俊达,,
银行的男员工都很小气，我们一个二级支行11个人，4男7女，每周轮流请客，女的都请了，到男的就跳过去，不是身体不好就是家里有事，还有个家伙从另外一个男的额那里抢来300块钱说下个星期请客，说了一年了，那300块还在自己兜里呢！银行的男人都是会计出身，会算啊！当然我还是不精的。,习惯了糗的人生,,
"之前去泰国旅游，团里有一个两岁多的小姑娘叫小喵喵，那天在泰国一个很大酒店大堂等领队给我们分房卡，妈妈一再提醒她不要乱跑，年纪小吧，还是跑了起来，一个不小心摔倒了，妈妈生气了。把小喵喵拉到一个柱子前双臂交叉到胸前正准备教育她一下脸部表情都酝酿好了，正准备要发飙，小喵喵这个时候双手合十瞪大眼睛看着妈妈说了一句,萨瓦迪卡～～全场的团友都被逗笑了，才一个两岁的小朋友没有人教她啊，妈妈最后也忍不住笑了起来……都没有人觉得好笑吗？",柚馡艾湘随,,
去年这个时候，晚上，我的结拜大哥（真的是磕头拜把子那种）给我打电话要5000块钱急用，我想都没想就马上转了过去，结果到现在一年了，再也没有联系过我，还天天的朋友圈晒美食，何解,从来没有当过伴郎,,
"今天终于打响了新年的第一炮。,是的，穿越火线踢腿炮！！",有座坟葬着未亡人,,
那年高中集体中午出去清雪，和另一个男生一人买了个小瓶的二锅头，美其名曰“暖暖身子”，然后，就被全被男生分了，犹记得，那天下午的课我们班上的很嗨,暮云,,
此生绝不再养狗,如来吃饭不吃米,,
为了学车，我暂时搬进驾校的训教场地——都是钢板房。这都不冬天了这每天晚上冻得我直打哆嗦。可想到教练一年一下来不管多冷多热都要住在这种地方，我不禁默默敬佩起来，也坚强的忍下来。直到有次闲聊我才知道——教练住的屋子有空调。,无底线的小白菜,,
