nr,zh,auth,span小时候，某日白天睡着了，老妈中午做饭，需要用糖，叫醒了，迷迷糊糊去买，走到半路清醒了，但不确定是买什么了！好像是买糖，但做饭应该用盐啊？在路上犹豫徘徊，十分钟后决定回家问。被家人嘲笑好久！,驭风而行,,
看到这个我就乐了  155的个想穿出165的范儿。首先你dei瘦，要是155、是个胖子呢？你能想象出的画面,晚上贼精神,,
老板，来包阳光利群！,坚不可摧摧,,
"儿子两天没有大便了-----背景咯咯咯-----刚刚在被窝里，媳妇突然问“是谁放 屁了？”,儿子笑着说“系我。”,媳妇“还是原来的配方，还是熟悉的味道。”",cz小李哥,,
记得读初中时，晚上在电脑上用qq和同学聊天！突然他发了一个链接过来，我打开一看……天啦……我瞬间满脸通红，下面也支起了小帐篷，于是情不自禁的撸起来。突然……卧室门开了，我连忙关掉视频并随意打开了一个qq空间！我爸进来二话不说就给我一巴掌:畜生！然后就出去了……我一脸懵逼回头一看:哇日……我打开的是我表姐的空间，里面全是自拍……,饮最烈的酒、艹最爱的人,,
被爱的人不流泪。幸福的人不晚睡。,最是奢侈少年梦。,,
最可怕的莫过于单身久了，忘记了怎么去认识新的人。,可可夏*,,
听朋友说的：一个女孩95年的，已经结婚生子。一天晚上带着儿子去广场见网友，那个网友问她的儿子，这是你什么人，那个女孩竟然说：这是我弟弟。,。要啥自行车,,
不知是不是因为大姨妈刚离开导致的现在很想要……,,,
"楼主幼师，今天和同事一块聊天，她在天南地北的吹，我很无奈的说了句，别吹了，不吹会死呀，她说""你都是我买的充气娃娃，不吹怎么行呢""天哪，这话接不下去了，在线等……",♀一大奇葩,,
小时候父母不忍心说穿我们看的童话，现在我们不忍心戳穿他们分享的朋友圈。,老衲喜欢豆腐乳,,
陈思诚出轨了  还一次找俩 ！难道那些曾经骂马蓉的亲们 都不玩糗百了吗？女人出轨就该被唾沫淹死 男人出轨就该祝福俩人和好如初？哎 其实 我也希望他媳妇能包容～,林、妹、妹,,
居然被鄙视了。可悲,翻滚吧！蜗牛,,
每次给老公口，老公都很享受，每次都能发出呻吟，我就会很兴奋，觉得这是对我最好的肯定,,,
快过年了 还是会疯了似的想家  只能把这份想念淡化在祖国的边境里,嗨！Mrs.Leta,,
终于知道我家为啥穷了，10年我家拿两万去存5年死期，，最可怕的是不知道咋回事到最后竟然是10年的，我就想知道它能有多少利息，2020年的两万跟2010年的两万差了多少！,Never1997,,
今天看到一篇新闻是番禺运钞车大劫案是如何破的，大谈特谈，我是真没见过如此厚颜无耻的，要不是人家自首，别说21年，估计210年也破不了,明六如,,
跟老婆打赌，输的要做一个月家务。规则是:她在1到10里选一个数字，写在纸上放进盒子里。我可以猜6遍，猜中就赢，猜不中就输。为了不让我偷看，她走进房间写。门半开着，我在外面瞄到她掷骰子选数字……我当时就乐了，骰子只有1到6点，我可以猜6遍，这不是送分题吗？忍着笑等她走出来，我果断说:“1到6任意一个数！”现在，我看着纸上的“8”陷入了沉思，为什么她要掷骰子？为什么不关上门？为什么我能看到她掷骰子？,钻戒礼服和我的她,,
大饱眼福的时候到了，,翻滚吧！蜗牛,,
一看就不是亲生的，,翻滚吧！蜗牛,,
两同事聊天，扯起了各自的小孩。女同事说有一次他家还在上幼儿园的儿子因为做错事被她训了一顿，结果那娃生气了说要跳楼。然后气嘟嘟的就往阳台跑，她跟着出去后果然看到那小子在爬阳台。还好她跟得快，当场就抱下来了，吓得她们家第二天就请人封了阳台。,约定的时候,,
下午在公司感觉有点肚子痛，上厕所发现大姨妈造访，然后问女同事借姨妈巾，她还没听清旁边有个男同事问什么然后马上脱口而出“卫生巾啊”，我去，好尴尬，他接着说“大家都是成年人嘛”。。。第一次碰上这么直接的男同事。。,思清唯一,,
下班房门打不开，还以为走错了楼号，硬是下楼确认了一下，没有错。初步判断门坏了。终于，费了好一番功夫把门打开了，为了再次验证一下我的观点没有错，再次把门关上，果然，门又打不开了……智商被狗吃了，此时的心情，万马奔腾！,以污会友。,,
上班的幼儿园新铺了草毯，我对小朋友们说:大家可以在在草毯上爬一爬，滚一滚，尽情玩吧！我孩子说:像狗一样？原谅我实在憋不住笑吧，童言无忌,真某想好,,
一万年没发过帖子了，割鸡割鸡。朋友自嘲自己为中央空调，旁边女性朋友不屑的看了一眼说:中央空调？就你这身高，顶多就是个地暖。,零度的微笑。,,
认为最悲哀的不仅是找了一个女票还得继续天天撸，而已连说心里话的人都找不到!悲哀呀！工作还特么那么辛苦,一根负债累累的枪,,
现在的糗百真有意思，话题讨论里有个话题竟然是：陈思诚出轨，你怎么看？     我怎么看？我还能怎么看啊！如果网上有的话，我当然是赶快下载看喽。 嗯哼，挑挑眉，你们懂的。,,,
感觉最近有点肚子，来健身房锻炼一下。看到有个Man一边举哑铃一边照镜子，我就问他：“你的八块腹肌是怎么练的好棒啊”，他欣赏着镜子里的自己，对我说：“我的身材天生就这么好，我只是来这里秀一下”,好看的大片子,,
每次来大姨妈那几天，到晚上睡觉时无论多注意，都会弄到床单上。直到后来我想了个办法，垫上姨妈巾后在尾椎的位置再垫上两三张双叠的卫生纸，保证不会弄到床单上。真的我已经实施了三年多了，量再大也不用担心！,,,
一张图片表达的我心中所有的心酸，20多岁居然秃了,A——杰,,
这两天北京没有雾霾，早上起来晴空万里！讲真，这都是我的功劳，是因为我没抽烟，我要抽烟，早上起来北京连太阳都看不到！,落花飞雪0403耀,,
老板的媳妇下午生了，老板发了一条母子照片的朋友圈，本来想讨好讨好老板评论真像嫂子，尼玛看也没看打了个真像傻子，不说了，写辞职信呢！,就是你烦爺,,
我终于知道为什么那部武功叫葵花宝典了，因为练功的人最后都会菊花变葵花。金老先生的书果然博大精深！,还是朋友吗？0991,,
"家居店，我跟一个美女站在一起。,我坚定地说：这辈子我要定你了！,美女问：你确定？,我郑重点头：我确定！,美女：好的先生，这被子三百块！",终极X匿名用户,,
"今天在公司又犯了一个常见的低级错误，,经理:我说过的话你都记住了吗？,我:记住了，,经理:还在犯这么低级的错误，你记住的是狗屁！,我:是，是，是，领导说的是！",丿秋风落叶丨,,
同事老家带了两袋柠檬来公司，一袋约一百斤。只有有我一个男的在，然后我就扛着上楼，走到二楼，两个女的在聊木耳的N种吃法，我忍不住笑，然后就岔气了摔倒在楼梯间！,没船的船长,,
"昨天，部门聚会。,领导来敬酒，我们都痛快的喝了，领导只是做了做样子，正准备走的时候。耿直的我站起来对着他说，×总，你常说把我们当兄弟，这杯酒是兄弟我敬你的，说完，一饮而尽，这么多兄弟看着，你可以随意。今天进公司就听到有同事说，某部门有个二楞子把老总给灌醉了，谁不知道领导来敬酒，都只是做做样子的，那二愣子却当真了。,唉，这领导真不行，才七八斤酒就喝趴下了。",向南就看北,,
"我爷爷去世已经一年了，还有几天休假回去上坟。以前接他电话总是怕接，嫌啰嗦。,现在那个号码再也没有打来过，想听一听啰嗦也听不到了，我现在最害怕的就是回忆他在世的时候，不太敢去想，现在说这些便流泪，喉咙里酸痛酸胀，泪腺一瞬间变的发达。,会有人说矫情，那是因为你们没有失去过最亲最亲的人，有人会说何必来这里诉说，那是因为你不懂失去最亲的人之后那些情感你不知道该跟谁说，也许手机码字才是最好的倾诉。,这些字一个个显现的时候我看着它们，眼泪一发不可收拾。谁能感同身受...........我很想你啊,我想回到过...,查看全文",请叫我螃蟹,,
一家人围在电脑看白娘子传奇，我七岁的儿子看到白娘子变成蛇那段说这是因为竹叶青的毒发作变成蛇的，说的头头是道告诉我白娘子是条好蛇，不吃人，让我给他买条这样的蛇做宠物…买条白娘子…哪里卖！,大漠没有谣,,
以前老觉得糗百好熟悉，想了老久才想起来，糗百就像以前的短篇故事会！！,恋上这里,,
"说一真事，，，我爸一直对我一个哥们有偏见，他这样给我妈说,“你知道你儿子都交那啥朋友，比你儿子还懒，我去他卧室一看，比你儿子的床还糟糕，你儿子起床后被子最起码还是卷个洞。早上起床爬出来，晚上钻进去就能睡，他那朋友那被子直接扭成麻花，晚上睡的时候还要找反正，，真是猪找猪，狗找狗”",石榴裙下的骚年,,
和男友做过最二逼的事就是，我碰他胳膊一下，他碰我胳膊一下，我又打他胳膊一下，他又打我胳膊一下，打来打去，我强忍着眼泪，打来打去，谁也没服，最后把我给打哭了……,小玉玉玉玉玉玉玉,,
"楼主平时不怎么给我家小妖精吃太甜的东西（背景）。。。。。。前几天小妖精有点拉肚子 就从医院拿了点药吃 开始楼主以为是苦的 还两个人共同作战 没想到喂了一口 她居然抱着杯子咕嘟咕嘟几口喝完了......自此以后只要她看到类似药包的东西往杯子里倒 她那小短腿就风火轮似的窜过来,我怎么会生这么个吃货。。。。。。",小小西西瓜,,
那一天爸妈吵架   然后我在旁边看着   我妈突然看着我对爸爸说   你在给我吵吵我就让你失去亲人的滋味  老妈说完转身去拿一个瓶子过来  一把把敌敌畏塞我嘴里了   亲妈啊。,Coquettish阿玲。,,
在这智能手机和网络盛行的年代，用信纸写信仿佛是上辈子的事了。不知为何我倒是挺怀念那段青葱岁月。悄悄的将自己的心事诉诸笔端，然后盼望着友人的回音。收到回信之后难以抑制的喜悦，以最快的速度读完回信再慢慢回味。忍不住又开始给友人写第二封信。就这样循环往复，直到某一天我们成为彼此的回忆。,阳春佐罗,,
现在组织里的暗号也太那啥了吧，刚才在微信群里说天王盖地虎，整个群一半人都对的上暗号，然后在问，组织里的？结果一个都不是，现在这暗号还有毛用啊,触碰心灵的语录,,
多年的感悟，发现身边没有可以倾诉的朋友，同事就是同事，很多心里话，一说出来，日子久了，就能从别人的嘴里传到自己的耳朵，远方能谈心的朋友，却不了解自己的现状，也很难理解。算是一种现实的悲哀,,,
刚不小心张嘴吃进个蚊子或什么小虫子，惊得我手抓着喉咙干瞪眼，待回过神，我脑抽地来句：悟空，你又调皮了，快出来吧……哎，没救了,孤独D2D,,
"傍晚在镇上住的，闲来没事下楼溜达看见个妹子在路灯下哭得好伤心，出于好心我就问她怎么了，需不需要帮助，然后她说跟男朋友吵架了，一个人跑出来了，身无分文。我看着挺可怜得就领回来了，然后不经意间知道了她男朋友打她了.我就脱了她的衣服，想给她的伤口上药酒，但是还没上呢，你们就来了。,警察同志你信我啊，我说的都是实话！！！",屌丝命~土豪梦,,
真事我了去了，刚才卫生间看糗事，把烟头要丢到马桶结果光注意手机了，一下烫到jj了，没想到这糗事会演在自己身上,黑曼巴的爱,,
中午去逛超市，看见一美女吃力踮起脚尖拿货架上的东西。我过去搭讪问道“要帮忙么”？她害羞点了点头说：谢谢。我踮起脚尖，发现也够不着……,效率啊,,
小侄子5岁了跟奶奶一个房间睡，准备让他自己睡，他说我还是小孩子，我还没长到100岁，怎么能让我一个人睡觉。现在小孩子逻辑思维好成熟,陈莉丽,,
今天去超市买东西，买好出去付账的时候，突然来了个服务员，他说先生收银在这边，一般超市收银员都是女孩子，我走到收银员那里，我问你手银吗？舒服不舒服，结果TMD被骂的狗血淋头。,独孤迎风八百里,,
"取名禁忌：姓马的不能叫蓉，姓赵的不能叫高，姓秦的不能叫桧。。。,他们之所以能千古留名，皆因他们触碰了时代最敏感的神经。,秦始皇代表最高权利，而赵高偏偏触碰了；岳飞代表民族英雄，而秦桧偏偏触碰了。,宝宝代表了我们这个时代每个屌丝心中醉美的梦：原来屌丝也可以有名，有利，有娇妻，有爱子。。。而马蓉，打破了数亿屌丝心中的梦。。。！,金莲弑夫，罪大恶极，却尚有唤醒时代女性自由之心的大功德。,马蓉所为，除了唤醒时代女性不择手段追名逐利之心，除了令天下屌丝心寒不已。。。有何功德？",来奥来,,
"团购东 北大拌 菜，和小美女一起看，看的我俩津津有味哒，她突然对我说:“看把你馋的！”“我的表情表现的很明显么？”“哦……表情掩饰的倒蛮好，看不出来啥，但你的哈喇子滴我手机上了！”呃……,胖香",莫纳~纳花依然,,
"大学和女友异地恋，放假去找她，对是路痴的我来说真是历尽千辛万苦。宿舍找到她，看就她一人在，我一脸认真的说：在我们路痴眼里，一条路正着走和反着走是不同的，白天走和晚上走是不同的，你们这些正常人是永远无法想象，我是怎么把一条街都能看成，横看成岭侧看成峰的魔幻效果……,女友不语撕掉衣服躺在床上道：来，路痴，我看你会迷路吗？？      我擦。。。,莫纳~纳花依然",音晴未雨，流星,,
逛淘宝突然想淘宝上会不会有卖棺材的，就搜了一下，还真有！可是接着好几天一打开淘宝，就向我推荐花圈寿衣骨灰盒……尼玛啊，我真想剁手！,a阿姨吖,,
看到第一次坐飞机的段子。相想我第一次坐飞机去斯里兰卡，英文不是很好，空姐送餐的时候问我喝什么，虽然有点渴但我装作很深沉的样子摆摆手，结果剩下4个小时的时间，我渴的没办法了去厕所洗手盆洗了手沾了沾唇。（北京机场不上带液体上飞机）。到后来坐飞机，哈哈哈，连餐叉我都给偷走了。,。要啥自行车,,
你们说，西游记里的沙和尚，担子里挑的是什么？你要说是衣服吧！他们从来没换过衣服，要说是吃的吧！他们每次都去化斋。要说是土特产，为什么见到如来佛求去真经后，还要挑回来。我猜是麻将,愿意不愿意。,,
今天中午，我在面馆吃饭，听到有人说，他那个小兄弟命里缺水，叫刘浩雨，旁边人说不行，一个村的有叫的了，所以，他让帮忙在想一个，姓刘，缺水，水越多越好！,若相守ぃ卟離,,
期末了，今天好不容易考完试，却要阅卷，各种答案使劲冒出来，话说阅读题，最后一问一般都发挥空间比较大，问“你喜欢猫头鹰吗？请说出理由”然后一个答案是“喜欢老鼠，因为老鼠会被猫头鹰吃了”顿时反应不上来,半墙绿藤,,
上中学时有一年冬天发小感冒，陪她去学校后面的诊所打针。一般打针都是把裤子褪下露半个屁股，打完大夫就会随手把裤子提上，那次打完，发小一直嚷嚷说屁股痛，让我帮她看看，我去，针头还在屁股上挂着呢！,^O^污力满^O^,,
只为你的一笑,,,
"我的朋友圈今天被刷屏了，多少娃娃会被男女双打。。。。。。。,本周重要的三件事[捂脸][捂脸][捂脸],1、陪娃复习要沉得住气，切记娃是亲生的，他不会，是因为遗传于你！,2、周二考完试别问考的好不好，先给娃一个大拥抱，再请娃好好吃一顿，毕竟他也辛苦一学期了！,3、出成绩切记要淡定，控制好体内的洪荒之力！,这个世界上最宽广的是海洋，比海洋更宽广的是天空，比天空更宽广的是考试范围，比考试范围更宽广的是看到娃成绩时家长的胸怀！",粉兜丫丫,,
晚上洗脸刷牙，洗面奶和牙膏都是白色皮的，然后刷完牙，拿起洗面奶就放牙缸里，一气呵成的把刚刚用过的牙膏挤手上搓泡泡准备洗脸……好在手心传来阵阵凉意，不然真用牙膏洗脸了……,"个性,飞扬",,
不算糗，有点长，今天小外甥在我家把杯子摔了，估计怕我说他，就自己把门锁了，完事我去叫门，自己开不开了，最后好不容易开开门了，我问他口渴不，他说舅舅我不喝水，我就逗他，我给你倒水吧！外甥说不喝，然后中间各种墨迹，最后才承认自己把杯摔了，我问他杯子在哪，人家告诉我床底下一点沙发下一点，茶几下一点，电视柜下一点…估计怕我说他，自己把摔碎的杯子藏了，我小外甥才4岁啊这不是要成精么,你好！单身汪,,
周一上化学课的时候我有点饿，然后就拿着烧饼吃，吃完想起来还有个苹果，就开始啃苹果。化学老师在上面看着，我俩对视一眼，我继续啃，他往旁边看。周二的时候……上课前拿出来苹果准备一边看小说一边啃。然后……我就又看到了化学老师，就听见他说：小姑娘，昨天上课你也吃，今天上课你还吃，上我的课你是有多饿啊？,美如戏子,,
"前提：年会上主管派我去给领导们敬酒；,我：为什么是我去呀！,主管：组内就你能喝白的，不你去谁去；,我：有好几个股东一年到头才能看见，我不认识 要不你领我过去介绍一下；,主管：卧槽！我过去不就成了“陪葬品”了，再说我也不会喝白的；,我：敢情是要我去“送死”啊！ π_π",听风-听雨-听呻吟,,
石家庄车牌冀ADQ637车主是个女的，在外面约情人，而且还不止一个，如果这女人的老公也看糗百的话，哥只能帮到你这儿了，不为别的，只因为很讨厌这样水性杨花的女人！,（乳）来伸掌,,
老婆打工回来了。儿子零花钱涨到一百也不肯下楼。,月经常挂在空中,,
刚才做梦梦到曾经的她了，醒了就睡不着了。这么多年了，在梦里已经梦不到她具体的样子。只能感觉到，还是哪个人儿！前几天胖香喝过酒说了一句话，到现在我还忘不了。她说:不是不想爱，只是怕再受到伤害！付出了全部，换回来的只有背叛。发这里不是想多少人看到。只是不能发朋友圈儿。又想把这些话说出来。,八二年的纯甄,,
"第一次发糗百，还请各位糗友不要手下留情^_^,今天下班看一路看糗百回家，完全不理会地铁拥挤的人流～,而且你会发现时间过得好快～,就比如说我吧，半小时前就蹲在家门口看糗百了，到现在我还蹲在这...,钥匙是什么鬼？有糗百好看吗？",五笔搜狗。,,
今天女票跟我说，她从幼儿园就是班长，小学，初中都是三好学生，大学门门功课都能得A……我遇到她是我撞大运了.我一时糗百精神上身说，是是是，你优秀，你优秀到胸都是A。,对的妳在哪,,
我哥是个爱说脏话的人，谈了个书香世家的女朋友，父母都是斯文人，在去女方家拜访前，女朋友一再嘱咐我哥，一定要注意说话，千万千万不要说脏话，我哥也严格要求自己，精神高度紧张，到了女朋友家装的跟个鹌鹑似得，好在装的像，女方父母也挺满意，宾主尽欢，终于到了告别的时候，女方父母依依不舍的送出门，出了门我哥心里一放松，张口就来了一句：快他妈回屋吧，瞅你俩冻得那嘚嘚瑟瑟逼样。后来～就没有后来了～我现在也没有嫂子～,绾青丝。。。,,
前段时间为了摆脱老爸的纠缠，我就忽悠说有女朋友了，结果他为了准备我结婚，卖了套房子，老子今年都不敢回家了，草！,寂寞成瘾。。。,,
理想很丰满，现实很残酷！,苏仙岭观日,,
"看了那篇年轻妈妈带着一双儿女跳楼的报道,虽然已经是新社会了，男人们也渐渐更懂得尊重和理解女人。,但不可否认，也有一部分男人还没有成长起来，无关年龄，只是心态。,心疼那个年轻妈妈，也许我不能完全体会那种感受，但是也能理解她所忍受的煎熬和痛楚。,人生苦短，珍爱生命。,希望我的婚姻，聚也好，散也好，我都能不忘初心。,好好爱我的妞妞，好好的快乐生活。",假如，真有天意,,
"到药店,我:买一瓶医用酒精。,店员:9块9,我:10块,一手钱一手货。,然后我站那里等了半天，等着找钱……,良久，店员看到我没走，问到:还有事？,我:找钱啊……,店员:我说9块9，你自己说的10块，给了我10块，还让我找？？？,我:……",醉入韶年,,
"昨天晚上看《舌尖上的中国》，结果半夜饿的肚子咕咕叫；今天吃的饱饱的接着看，还不到一个小时呢又饿了……,肚子咕咕叫，难受谁知道？",包子＊小狗不理我,,
"我媳妇儿在某培训机构当客服，需要向家长登记学员姓名，“我们这边咨询需要登记一下您孩子名字，请问您孩子叫什么呢？”,“Li Bang”,""请问李是木子李吗？"",“是的”,“bang呢？”,“嗯。。。。。。。。棒槌的棒！~哈哈哈哈”家长自己不蛋定的笑了。。。",我叫王大锤！！！,,
跟儿子看电影因为是外国片听不懂所以儿子不想看，我自豪的说:没事妈妈给你翻译（我其实也听不到）电影开始全是打斗的画面所以我一直在陪哼哼哈嘿的配音，打斗结束第一句话说是把抢放下！儿子高兴的跳起来说妈妈我能听懂原来我英语那么好哦，我瞬间懵了？,jd幺幺之紫霞仙子,,
这顿饭吃的特孽心……,Duza肚子,,
明天就考试后天就放假了呢。,Sunshine0-0,,
看看咱圈里人的觉悟,笑别人，别人笑,,
今天早上         我在床上躺着呢，两岁多的儿子在和我闹，用脚踢到我的眼好疼，我就装佯哭了两声，认为他会安慰我一下，谁知传来了两字＂我跑＂睁眼一看，已经跑到客厅了,风大了，雨下了。,,
"有一年年底了，老板请工友们吃饭，大概十几个人吧，去的川菜馆。让大伙点菜，工友们都推辞:哎呀，随便随便，老板点啥子我们吃啥子！,于是老板拿过菜单（薄薄的一张A4纸）手指一划拉:“嗯，这一面炒了，翻过来……哦，这一面也炒了……”,嗬……服务员和我们那个表情啊…(⊙x⊙;),.",昭昭白玉堂,,
这就尴尬了！,若爱，请下载,,
昨天男朋友说想吃火锅，然后我就去超市买了好多吃火锅的菜，刚好有玉米，我比较喜欢吃玉米，就多买了几根，然后昨晚吃的时候他就问我，你男朋友味道咋样？没啥异味吧？,画上青衣う墨染,,
有个事吧，想问问大家了，就是糗百这里有个陌交软件了，我下载了，注册了，想脱单了，可是碰到的姑娘没怎么聊几句就要求见面了，困惑,痞子大大叔,,
我才一顿吃五个而已………,为什么非得起名字才能进糗百,,
最近几天忙着种土豆，耙完地要放线，我从线上踩过去留下一条直线，我还跑的挺欢，老公就说了看你给个小猪样，踩过去脚印那么深。。。当时我就下不去脚了，胖咋滴，全是吃你家饭。。冬天谁还不长点肉抗冻抗冻,小甜瓜？？,,
初恋生了个闺女，九斤半！！终于有希望了,异地翔,,
开夜车经常遇到不关远光的，先闪两下提醒对方，遇到提醒了都不关的，远光直接照过去。来呀来呀，互相伤害呀。,特么想个昵称好难,,
前段时间我家附近各个路段的井盖总被偷，前两天去城郊玩的时候，低头偶然发现井盖上写了四个大字“小偷勿偷”当时就在想，谁干这么缺心眼的事。结果过几天井盖又不见了，就剩下个井啊井旁边用粉笔写着“警告无效”,小丫头骗子i,,
"记得04年上大学的时候，手机还不像现在这么普及。,寝室联谊活动，一个男生有点小帅，活动后就去打听他的号码。人是这么回答的：不用那玩意儿，烧钱！,当时瞬间就觉得自己太不懂事了，太铺张浪费了，太可耻了，居然用手机！,现在想想，他tmd不就是穷么？还说的这么义正严辞…",哎呦喂哒哒滴,,
